{
  "description": "A docx template's embedded fonts resolve its families (§3): Brand Serif, obfuscated as Word embeds it (ECMA-376 Part 1, section 17.8.1), and Brand Sans, embedded plain. Brand Body, which its document defaults name, resolves nowhere: `font_unresolved`.",
  "spec": [
    "§3",
    "C62"
  ],
  "oracle": "none",
  "format": "docx",
  "template": "brand.dotx"
}
