{
  "description": "A JPEG's EXIF orientation turns the picture upright, fitted by its upright shape. Content a layout has no slot for still shows: in the layout's first content placeholder (Section Header), else in a shape of its own over the master's body area; a title on Blank is a title placeholder of its own over the master's title area.",
  "spec": [
    "§8.6",
    "§8.8",
    "C53",
    "C55"
  ],
  "oracle": "corrected",
  "format": "pptx",
  "assets": [
    "rotated.jpg"
  ]
}
